{
  "canvas": {
    "height": 540,
    "viewBox": "0 0 960 540",
    "width": 960
  },
  "content": {
    "date": "JUN 23",
    "eyebrow": "MUSEUM PROGRAMME",
    "programme": [
      "Opening forum",
      "Artist walk",
      "Public lecture",
      "Archive screening"
    ],
    "subtitle": "Curatorial agenda with one yellow signature and clear public programme rhythm.",
    "title": "Young Artists Biennale",
    "venue": "North Hall"
  },
  "quality_constraints": {
    "max_title_lines": 2,
    "min_font_size": 16,
    "safe_area": {
      "height": 460,
      "width": 864,
      "x": 48,
      "y": 40
    }
  },
  "safe_area": {
    "height": 460,
    "width": 864,
    "x": 48,
    "y": 40
  },
  "semantic_elements": [
    {
      "bbox": {
        "height": 88,
        "width": 710,
        "x": 56,
        "y": 96
      },
      "element_id": "title",
      "kind": "text",
      "role": "title",
      "source_ref": "canvas_spec.content.title"
    }
  ],
  "template_id": "biennale-programme-poster",
  "theme": {
    "colors": {
      "accent": "#D8AA00",
      "background": "#F8E6A0",
      "muted": "#5F5331",
      "panel": "#111111",
      "primary": "#111111",
      "surface": "#FFF6CC",
      "text": "#111111"
    }
  },
  "theme_id": "biennale-yellow",
  "version": "svglide-canvas-spec/v1"
}
