{
  "version": "svglide-canvas-spec/v1",
  "canvas": {"width": 960, "height": 540, "viewBox": "0 0 960 540"},
  "safe_area": {"x": 48, "y": 40, "width": 864, "height": 460},
  "template_id": "architecture-blueprint",
  "theme_id": "blueprint-technical",
  "theme": {"colors": {"background": "#071827", "panel": "#0E2A3F", "primary": "#5EEAD4", "accent": "#F97316", "text": "#EAF6FF", "muted": "#93B4C8"}},
  "content": {"eyebrow": "ARCH", "title": "系统职责拆分", "subtitle": "叙事、画板和导出各自收敛。", "nodes": ["Deck Planner", "Slide Planner", "CanvasSpec", "Template", "Satori", "SVGlide"]},
  "semantic_elements": [{"element_id": "title", "kind": "text", "role": "title", "source_ref": "canvas_spec.content.title", "bbox": {"x": 56, "y": 96, "width": 630, "height": 88}}],
  "quality_constraints": {"max_title_lines": 2, "min_font_size": 18, "safe_area": {"x": 48, "y": 40, "width": 864, "height": 460}}
}
