{
  "version": "svglide-canvas-spec/v1",
  "canvas": {
    "width": 960,
    "height": 540,
    "viewBox": "0 0 960 540"
  },
  "safe_area": {
    "x": 48,
    "y": 40,
    "width": 864,
    "height": 460
  },
  "template_id": "architectural-spec",
  "theme_id": "stone-architect",
  "theme": {
    "colors": {
      "background": "#EFE9DC",
      "panel": "#F8F4EA",
      "primary": "#5F5549",
      "accent": "#A28A6A",
      "text": "#27221D",
      "muted": "#756B60"
    }
  },
  "content": {
    "eyebrow": "ARCHITECTURE SPEC",
    "title": "系统架构规格",
    "subtitle": "低密度几何和 hairline rows 适合正式架构说明、空间规划和研究目录。",
    "rows": [
      "输入边界",
      "处理结构",
      "接口契约",
      "交付节奏"
    ]
  },
  "semantic_elements": [
    {
      "element_id": "title",
      "kind": "text",
      "role": "title",
      "source_ref": "canvas_spec.content.title",
      "bbox": {
        "x": 56,
        "y": 70,
        "width": 760,
        "height": 132
      }
    }
  ],
  "quality_constraints": {
    "max_title_lines": 3,
    "min_font_size": 15,
    "safe_area": {
      "x": 48,
      "y": 40,
      "width": 864,
      "height": 460
    }
  }
}
