{
  "version": "svglide-canvas-spec/v1",
  "canvas": {"width": 960, "height": 540, "viewBox": "0 0 960 540"},
  "safe_area": {"x": 48, "y": 40, "width": 864, "height": 460},
  "template_id": "data-story",
  "theme_id": "glass-neon",
  "theme": {"colors": {"background": "#090B1A", "panel": "#14172E", "primary": "#22D3EE", "accent": "#C084FC", "text": "#F8FAFC", "muted": "#BAC3D9"}},
  "content": {"eyebrow": "DATA", "title": "活动强度变化", "subtitle": "用少量指标讲清趋势。", "metrics": ["北区 42", "南区 35", "西区 28", "东区 19"], "callout": "北区持续升高，需要重点观测。"},
  "semantic_elements": [{"element_id": "title", "kind": "text", "role": "title", "source_ref": "canvas_spec.content.title", "bbox": {"x": 56, "y": 96, "width": 600, "height": 88}}],
  "quality_constraints": {"max_title_lines": 2, "min_font_size": 18, "safe_area": {"x": 48, "y": 40, "width": 864, "height": 460}}
}
