{
  "version": "svglide-canvas-spec/v1",
  "canvas": {"width": 960, "height": 540, "viewBox": "0 0 960 540"},
  "safe_area": {"x": 48, "y": 40, "width": 864, "height": 460},
  "template_id": "image-feature",
  "theme_id": "editorial-tritone",
  "theme": {"colors": {"background": "#F6E7DF", "panel": "#FFF7F0", "primary": "#9F1239", "accent": "#D97706", "text": "#351A24", "muted": "#7C5B62"}},
  "content": {"eyebrow": "VISUAL", "title": "地貌证据", "subtitle": "图像作为证据锚点，文字负责解释。", "image_label": "LAVA FIELD", "caption": "占位图后续由受控图片资源替换。", "points": ["明确主视觉", "保留安全边距", "说明不遮挡图片"]},
  "semantic_elements": [{"element_id": "title", "kind": "text", "role": "title", "source_ref": "canvas_spec.content.title", "bbox": {"x": 548, "y": 120, "width": 330, "height": 94}}],
  "quality_constraints": {"max_title_lines": 2, "min_font_size": 18, "safe_area": {"x": 48, "y": 40, "width": 864, "height": 460}}
}
