{
  "canvas": {
    "height": 540,
    "viewBox": "0 0 960 540",
    "width": 960
  },
  "content": {
    "eyebrow": "POLICY BRIEF",
    "notes": [
      "Define terms",
      "Separate evidence",
      "Act"
    ],
    "quote": "Evidence stays readable.",
    "stats": [
      "42 papers",
      "8 interviews",
      "3 scenarios"
    ],
    "subtitle": "Field notes on the discipline of less, written for designers who already know how to add.",
    "title": "On Restraint"
  },
  "quality_constraints": {
    "max_title_lines": 2,
    "min_font_size": 16,
    "safe_area": {
      "height": 460,
      "width": 864,
      "x": 48,
      "y": 40
    }
  },
  "safe_area": {
    "height": 460,
    "width": 864,
    "x": 48,
    "y": 40
  },
  "semantic_elements": [
    {
      "bbox": {
        "height": 88,
        "width": 710,
        "x": 56,
        "y": 96
      },
      "element_id": "title",
      "kind": "text",
      "role": "title",
      "source_ref": "canvas_spec.content.title"
    }
  ],
  "template_id": "vellum-scholar-brief",
  "theme": {
    "colors": {
      "accent": "#3A7878",
      "background": "#2A3870",
      "muted": "#D9D2A4",
      "panel": "#1F2858",
      "primary": "#E8D85C",
      "surface": "#343F80",
      "text": "#FFF7C7"
    },
    "typography": {
      "font_roles": {
        "display": "SVGlideDisplay",
        "body": "SVGlideBody",
        "label": "SVGlideLabel",
        "metric": "SVGlideMetric"
      },
      "role_tokens": {
        "display": {
          "font_role": "display",
          "source_font": "Cormorant Garamond",
          "runtime_alias": "SVGlideDisplay",
          "font_size": 54,
          "font_weight": 400,
          "line_height": 0.96,
          "letter_spacing": 0,
          "text_transform": "latin_uppercase_only",
          "max_lines": 3,
          "alignment": "source_layout_dependent"
        },
        "body": {
          "font_role": "body",
          "source_font": "DM Sans",
          "runtime_alias": "SVGlideBody",
          "font_size": 20,
          "font_weight": 400,
          "line_height": 1.32,
          "letter_spacing": 0,
          "text_transform": "preserve_source_case",
          "max_lines": 5,
          "alignment": "source_layout_dependent"
        },
        "label": {
          "font_role": "label",
          "source_font": "Courier Prime",
          "runtime_alias": "SVGlideLabel",
          "font_size": 12,
          "font_weight": 700,
          "line_height": 1.05,
          "letter_spacing": 0.08,
          "text_transform": "latin_uppercase_labels_reset_cjk_spacing",
          "max_lines": 1,
          "alignment": "source_layout_dependent"
        },
        "metric": {
          "font_role": "metric",
          "source_font": "Courier Prime",
          "runtime_alias": "SVGlideMetric",
          "font_size": 42,
          "font_weight": 900,
          "line_height": 0.95,
          "letter_spacing": 0,
          "text_transform": "preserve_numbers_and_units",
          "max_lines": 2,
          "alignment": "source_layout_dependent"
        }
      },
      "strategy_source": "skills/lark-slides/references/visual-contracts/beautiful/vellum.vellum-scholar-brief.json",
      "text_style_roles": {
        "bold": {
          "source_usage": "source uses heavy display/label weights",
          "mapped_weight": {
            "display": 400,
            "label": 700,
            "metric": 900
          },
          "allowed_roles": [
            "display",
            "label",
            "metric"
          ]
        },
        "italic": {
          "source_usage": "source uses italic/font-style or italic-family tokens",
          "mapped_style": "latin_only_when_source_requires_else_normal",
          "fallback_when_unavailable": "use color_shift or weight_shift; do not fake CJK italic",
          "loss_notes": "Satori/Slide may not provide exact Google italic face; record as visual approximation."
        },
        "underline": {
          "source_usage": "source uses underline/text-decoration or hairline emphasis",
          "mapped_decoration": "native underline only for actual text-decoration source usage",
          "fallback_shape": "1px-3px rule or border accent when underline font rendering is unavailable"
        },
        "line_through": {
          "source_usage": "not present in source; default no line-through",
          "mapped_decoration": "none",
          "fallback_shape": "none"
        },
        "emphasis": {
          "color_shift": "use source accent color roles only",
          "font_family_switch": "only switch between mapped display/body/label/metric roles from this family",
          "weight_shift": "increase one role step within font_weight_scale",
          "style_shift": "italic only when source_usage requires and CJK fallback is safe"
        },
        "text_decoration_policy": {
          "underline": {
            "style": "solid",
            "color": "currentColor",
            "thickness": "1px"
          },
          "line_through": {
            "style": "none",
            "color": "currentColor",
            "thickness": "0px"
          }
        }
      }
    }
  },
  "theme_id": "vellum",
  "version": "svglide-canvas-spec/v1"
}
