{
  "version": "svglide-canvas-spec/v1",
  "canvas": {"width": 960, "height": 540, "viewBox": "0 0 960 540"},
  "safe_area": {"x": 48, "y": 40, "width": 864, "height": 460},
  "template_id": "process-flow",
  "theme_id": "dark-clarity",
  "theme": {"colors": {"background": "#0F172A", "panel": "#111827", "primary": "#38BDF8", "accent": "#A78BFA", "text": "#F8FAFC", "muted": "#CBD5E1"}},
  "content": {"eyebrow": "FLOW", "title": "画板生成链路", "subtitle": "让内容、模板和导出职责分离。", "steps": ["Deck Plan", "CanvasSpec", "Template", "Satori", "SVGlide"], "conclusion": "每一步都留下 receipt，便于复盘。"},
  "semantic_elements": [{"element_id": "title", "kind": "text", "role": "title", "source_ref": "canvas_spec.content.title", "bbox": {"x": 56, "y": 96, "width": 730, "height": 88}}],
  "quality_constraints": {"max_title_lines": 2, "min_font_size": 18, "safe_area": {"x": 48, "y": 40, "width": 864, "height": 460}}
}
