{
  "version": "svglide-canvas-spec/v1",
  "canvas": {"width": 960, "height": 540, "viewBox": "0 0 960 540"},
  "safe_area": {"x": 48, "y": 40, "width": 864, "height": 460},
  "template_id": "executive-dashboard",
  "theme_id": "paper-research",
  "theme": {"colors": {"background": "#F7F3E8", "panel": "#FFFDF6", "primary": "#1E3A8A", "accent": "#B45309", "text": "#1F2937", "muted": "#4B5563"}},
  "content": {
    "eyebrow": "BUSINESS REVIEW",
    "title": "内部业务复盘",
    "subtitle": "单一强调色组织关键指标、渠道排序和管理层行动口径。",
    "metrics": ["收入 +14%", "留存 118%", "流失 2.1%", "管线 3.4x", "季度 +9%", "NPS 48"],
    "bars": ["企业客户 82", "中型客户 64", "SMB 48", "伙伴 36"],
    "chart_title": "渠道健康度"
  },
  "semantic_elements": [{"element_id": "title", "kind": "text", "role": "title", "source_ref": "canvas_spec.content.title", "bbox": {"x": 56, "y": 96, "width": 710, "height": 88}}],
  "quality_constraints": {"max_title_lines": 2, "min_font_size": 18, "safe_area": {"x": 48, "y": 40, "width": 864, "height": 460}}
}
