{
  "version": "svglide-canvas-spec/v1",
  "canvas": {"width": 960, "height": 540, "viewBox": "0 0 960 540"},
  "safe_area": {"x": 48, "y": 40, "width": 864, "height": 460},
  "template_id": "section-title",
  "theme_id": "blueprint-technical",
  "theme": {"colors": {"background": "#071827", "panel": "#0E2A3F", "primary": "#5EEAD4", "accent": "#F97316", "text": "#EAF6FF", "muted": "#93B4C8"}},
  "content": {"eyebrow": "SECTION 01", "title": "研究背景", "subtitle": "用一页建立后续叙事的语境。"},
  "semantic_elements": [{"element_id": "title", "kind": "text", "role": "title", "source_ref": "canvas_spec.content.title", "bbox": {"x": 104, "y": 176, "width": 680, "height": 122}}],
  "quality_constraints": {"max_title_lines": 2, "min_font_size": 18, "safe_area": {"x": 48, "y": 40, "width": 864, "height": 460}}
}
