{
  "canvas": {
    "height": 540,
    "viewBox": "0 0 960 540",
    "width": 960
  },
  "content": {
    "capsules": [
      "Drop one",
      "Creator proof",
      "Member perks",
      "Retail pilots"
    ],
    "eyebrow": "LIFESTYLE DROP",
    "stat": "12K waitlist",
    "steps": [
      "Tease",
      "Launch",
      "Retain"
    ],
    "subtitle": "Soft modular cards for a Y2K creator product line and three-step rollout.",
    "title": "Seasonal Launch System"
  },
  "quality_constraints": {
    "max_title_lines": 2,
    "min_font_size": 16,
    "safe_area": {
      "height": 460,
      "width": 864,
      "x": 48,
      "y": 40
    }
  },
  "safe_area": {
    "height": 460,
    "width": 864,
    "x": 48,
    "y": 40
  },
  "semantic_elements": [
    {
      "bbox": {
        "height": 88,
        "width": 710,
        "x": 56,
        "y": 96
      },
      "element_id": "title",
      "kind": "text",
      "role": "title",
      "source_ref": "canvas_spec.content.title"
    }
  ],
  "template_id": "capsule-card-system",
  "theme": {
    "colors": {
      "accent": "#FF7AB6",
      "background": "#F7E7FB",
      "muted": "#6D607B",
      "panel": "#FFE8A3",
      "primary": "#6D5DF7",
      "surface": "#FFFFFF",
      "text": "#231942"
    }
  },
  "theme_id": "capsule",
  "version": "svglide-canvas-spec/v1"
}
